<!DOCTYPE skills SYSTEM "skill.dtd">
<skills>
	<profession value="PARAGON">
		<spell type="RANGEATTACK">
			<name value="Barbed Spear"/>
			<costs value="2" type="ADRENALINE"/>
			<casttime value="0"/>
			<cooldown value="0"/>
			<targettype value="ENEMY"/>
			<range value="800"/>
			<weapon value="SPEAR"/>
			<effects>
				<impact>
					<condition value="5" scaling="SPEAR_MASTERY" target="TARGET" type="BLEEDING">
						<step key="1" value="6"/>
						<step key="2" value="7"/>
						<step key="3" value="8"/>
						<step key="4" value="9"/>
						<step key="5" value="10"/>
						<step key="6" value="11"/>
						<step key="7" value="12"/>
						<step key="8" value="13"/>
						<step key="9" value="14"/>
						<step key="10" value="15"/>
						<step key="11" value="16"/>
						<step key="12" value="17"/>
						<step key="13" value="18"/>
						<step key="14" value="19"/>
					</condition>
				</impact>
			</effects>
		</spell>
		<spell type="RANGEATTACK">
			<name value="Maiming Spear"/>
			<costs value="5" type="MANA"/>
			<casttime value="0"/>
			<cooldown value="5"/>
			<targettype value="ENEMY"/>
			<range value="800"/>
			<weapon value="SPEAR"/>
			<effects>
				<impact>
					<when value="TARGET">
						<whencondition>
							<condi type="BLEEDING"/>
						</whencondition>
						<then>
							<condition value="5" scaling="SPEAR_MASTERY" target="TARGET" type="CRIPPLED">
								<step key="1" value="6"/>
								<step key="2" value="7"/>
								<step key="3" value="8"/>
								<step key="4" value="9"/>
								<step key="5" value="10"/>
								<step key="6" value="11"/>
								<step key="7" value="12"/>
								<step key="8" value="13"/>
								<step key="9" value="14"/>
								<step key="10" value="15"/>
								<step key="11" value="16"/>
								<step key="12" value="17"/>
								<step key="13" value="18"/>
								<step key="14" value="19"/>
							</condition>
						</then>
					</when>
				</impact>
			</effects>
		</spell>
		<spell type="RANGEATTACK">
			<name value="Blazing Spear"/>
			<costs value="6" type="ADRENALINE"/>
			<casttime value="0"/>
			<cooldown value="0"/>
			<targettype value="ENEMY"/>
			<range value="800"/>
			<weapon value="SPEAR"/>
			<effects>
				<impact>
					<damage value="5" scaling="SPEAR_MASTERY" target="TARGET" type="ATTACK">
						<step key="1" value="6"/>
						<step key="2" value="8"/>
						<step key="3" value="9"/>
						<step key="4" value="10"/>
						<step key="5" value="12"/>
						<step key="6" value="13"/>
						<step key="7" value="14"/>
						<step key="8" value="16"/>
						<step key="9" value="17"/>
						<step key="10" value="18"/>
						<step key="11" value="20"/>
						<step key="12" value="21"/>
						<step key="13" value="22"/>
						<step key="14" value="24"/>
					</damage>
					<condition value="1" scaling="SPEAR_MASTERY" target="TARGET" type="BURNING">
						<step key="4" value="2"/>
						<step key="12" value="3"/>
					</condition>
				</impact>
			</effects>
		</spell>
		<spell type="RANGEATTACK">
			<name value="Stunning Strike"/>
			<costs value="6" type="ADRENALINE"/>
			<casttime value="0"/>
			<cooldown value="0"/>
			<targettype value="ENEMY"/>
			<range value="800"/>
			<weapon value="SPEAR"/>
			<effects>
				<impact>
					<damage value="5" scaling="SPEAR_MASTERY" target="TARGET" type="ATTACK">
						<step key="1" value="7"/>
						<step key="2" value="8"/>
						<step key="3" value="10"/>
						<step key="4" value="12"/>
						<step key="5" value="13"/>
						<step key="6" value="15"/>
						<step key="7" value="17"/>
						<step key="8" value="18"/>
						<step key="9" value="20"/>
						<step key="10" value="22"/>
						<step key="11" value="23"/>
						<step key="12" value="25"/>
						<step key="13" value="27"/>
						<step key="14" value="28"/>
					</damage>
					<when value="TARGET">
						<whencondition>
							<condi type="NONE"/>
						</whencondition>
						<then>
							<condition value="4" scaling="SPEAR_MASTERY" target="TARGET" type="DAZED">
								<step key="2" value="5"/>
								<step key="4" value="6"/>
								<step key="7" value="7"/>
								<step key="9" value="8"/>
								<step key="12" value="9"/>
								<step key="14" value="10"/>
							</condition>
						</then>
					</when>
				</impact>
			</effects>
		</spell>
	</profession>
	<profession value="WARRIOR">
		<spell type="UNIQUE_BUFF">
			<name value="Flail"/>
			<costs value="4" type="ADRENALINE"/>
			<casttime value="0"/>
			<cooldown value="0"/>
			<targettype value="SELF"/>
			<range value="0"/>
			<effects>
				<impact>
					<buff value="1" scaling="STRENGTH" usage="INF" trigger="NONE" type="STANCE">
						<step key="1" value="2"/>
						<step key="2" value="3"/>
						<step key="3" value="4"/>
						<step key="4" value="5"/>
						<step key="5" value="6"/>
						<step key="6" value="7"/>
						<step key="7" value="8"/>
						<step key="8" value="8"/>
						<step key="9" value="9"/>
						<step key="10" value="10"/>
						<step key="11" value="11"/>
						<step key="12" value="12"/>
						<step key="13" value="13"/>
						<step key="14" value="14"/>
						<attackspeed value="33" scaling="NONE" target="SELF"/>
						<movementspeed value="-33" scaling="NONE" target="SELF"/>
					</buff>
				</impact>
			</effects>
		</spell>
		<spell type="UNIQUE_BUFF">
			<name value="Enraging Charge"/>
			<costs value="5" type="MANA"/>
			<casttime value="0"/>
			<cooldown value="20"/>
			<targettype value="SELF"/>
			<range value="0"/>
			<effects>
				<impact>
					<buff value="1" scaling="STRENGTH" usage="INF" trigger="NONE" type="STANCE">
						<step key="1" value="6"/>
						<step key="3" value="7"/>
						<step key="4" value="8"/>
						<step key="6" value="9"/>
						<step key="7" value="10"/>
						<step key="9" value="11"/>
						<step key="10" value="12"/>
						<step key="12" value="13"/>
						<step key="13" value="14"/>
						<movementspeed value="25" scaling="NONE" target="SELF"/>
					</buff>
          <buff value="1" scaling="STRENGTH" usage="1" trigger="HIT" type="STANCE">
            <step key="1" value="6"/>
            <step key="3" value="7"/>
            <step key="4" value="8"/>
            <step key="6" value="9"/>
            <step key="7" value="10"/>
            <step key="9" value="11"/>
            <step key="10" value="12"/>
            <step key="12" value="13"/>
            <step key="13" value="14"/>
              <giveadrenaline value="0" scaling="STRENGTH" target="SELF">
                <step key="3" value="1"/>
                <step key="8" value="2"/>
                <step key="13" value="3"/>
              </giveadrenaline>
          </buff>
				</impact>
			</effects>
		</spell>
		<spell type="SKILL">
			<name value="Lion's Comfort"/>
			<costs value="4" type="ADRENALINE"/>
			<casttime value="1"/>
			<cooldown value="1"/>
			<targettype value="SELF"/>
			<range value="0"/>
			<effects>
				<impact>
					<heal value="50" scaling="STRENGTH" target="SELF">
						<step key="1" value="54"/>
						<step key="2" value="58"/>
						<step key="3" value="62"/>
						<step key="4" value="66"/>
						<step key="5" value="70"/>
						<step key="6" value="74"/>
						<step key="7" value="78"/>
						<step key="8" value="82"/>
						<step key="9" value="86"/>
						<step key="10" value="90"/>
						<step key="11" value="94"/>
						<step key="12" value="98"/>
						<step key="13" value="102"/>
						<step key="14" value="106"/>
					</heal>
					<giveadrenaline value="0" scaling="STRENGTH" target="SELF">
						<step key="3" value="1"/>
						<step key="8" value="2"/>
						<step key="13" value="3"/>
					</giveadrenaline>
				</impact>
			</effects>
		</spell>
		<spell type="UNIQUE_BUFF">
			<name value="Shield Bash"/>
			<costs value="5" type="MANA"/>
			<casttime value="0"/>
			<cooldown value="20"/>
			<targettype value="SELF"/>
			<range value="0"/>
			<weapon value="SHIELD"/>
			<effects>
				<impact>
					<buff value="5" type="STANCE" scaling="STRENGHT" usage="INF" trigger="DAMAGE">
						<step key="2" value="6"/>
						<step key="4" value="7"/>
						<step key="7" value="8"/>
						<step key="9" value="9"/>
						<step key="12" value="10"/>
						<step key="14" value="11"/>
						<block type="ATTACK" value="100" scaling="NONE" usage="1"/>
						<when value="TARGET">
							<whencondition>
								<attack type="MELEEATTACK"/>
							</whencondition>
							<then>
								<knockdown value="2" scaling="NONE" target="TARGET"/>
								<skillcooldown value="15" type="CURRENTSKILL" scaling="NONE" target="TARGET"/>
							</then>
						</when>
					</buff>
				</impact>
			</effects>
		</spell>
	</profession>
</skills>
